{
  "schemaVersion": 1,
  "localId": "00000000-0000-4000-8000-0000000000c2",
  "nickname": "Ejemplo",
  "role": "principal",
  "entryChannel": "CHNV",
  "i485ReceiptDate": "2025-08-01",
  "i485ReceiptDateGranularity": "day",
  "concurrentI765": true,
  "concurrentI131": null,
  "withAttorney": null,
  "basicDocs": {
    "paroleRecord": null,
    "nationalityProof": null,
    "i693": null,
    "photos": null,
    "feeOrWaiver": null
  },
  "milestones": [
    {
      "key": "parole_termination_notice",
      "date": "2025-06-12",
      "dateGranularity": "day",
      "dateSource": "notice",
      "meta": {
        "terminationNotice": "CHNV_JUN_2025"
      }
    }
  ],
  "createdAt": "2026-10-20T12:00:00Z",
  "updatedAt": "2026-10-20T12:00:00Z",
  "paroleDate": "2024-03-10",
  "paroleEndDateOriginal": "2026-03-09"
}
